{
  "schemaVersion": 1,
  "reportVersion": "m3-synthetic-evaluation-v1",
  "modelVersion": "secret-logistic-m2-synthetic-v1",
  "status": "experimental",
  "releaseEligible": false,
  "catalogVersion": "synthetic-generators-v1",
  "catalogReviewStatus": "pending-human-review",
  "datasetSha256": "48c0cd4b704b407fee613affcfbd4418694ec25d53a9b6f1e57fc2e377d8aebd",
  "trainingStateSha256": "0d398a98c34829408f4e863a1035415cd11be0e5b829ce58716aa88bd4caa451",
  "seed": 20260801,
  "evaluationSplit": "test",
  "thresholds": {
    "relaxedHigh": 0.9,
    "balancedMedium": 0.65,
    "balancedHigh": 0.9,
    "strictMedium": 0.5,
    "strictHigh": 0.9
  },
  "counts": {
    "records": 208,
    "groups": 52,
    "sensitive": 104,
    "benign": 104
  },
  "confusion": {
    "threshold": 0.65,
    "truePositive": 104,
    "trueNegative": 104,
    "falsePositive": 0,
    "falseNegative": 0
  },
  "metrics": {
    "accuracy": 1.0,
    "precision": 1.0,
    "recall": 1.0,
    "falsePositiveRate": 0.0,
    "falseNegativeRate": 0.0,
    "brierScore": 0.000911960195,
    "logLoss": 0.010759615708,
    "expectedCalibrationError": 0.010237400498
  },
  "confidenceBands": {
    "clean": {
      "count": 104,
      "sensitiveCount": 0,
      "sensitiveRate": 0.0,
      "warningPrecision": null
    },
    "medium": {
      "count": 4,
      "sensitiveCount": 4,
      "sensitiveRate": 1.0,
      "warningPrecision": 1.0
    },
    "high": {
      "count": 100,
      "sensitiveCount": 100,
      "sensitiveRate": 1.0,
      "warningPrecision": 1.0
    }
  },
  "calibrationBins": [
    {
      "lower": 0.0,
      "upper": 0.1,
      "count": 104,
      "meanConfidence": 0.007635110388,
      "sensitiveRate": 0.0,
      "absoluteGap": 0.007635110388
    },
    {
      "lower": 0.1,
      "upper": 0.2,
      "count": 0,
      "meanConfidence": null,
      "sensitiveRate": null,
      "absoluteGap": null
    },
    {
      "lower": 0.2,
      "upper": 0.3,
      "count": 0,
      "meanConfidence": null,
      "sensitiveRate": null,
      "absoluteGap": null
    },
    {
      "lower": 0.3,
      "upper": 0.4,
      "count": 0,
      "meanConfidence": null,
      "sensitiveRate": null,
      "absoluteGap": null
    },
    {
      "lower": 0.4,
      "upper": 0.5,
      "count": 0,
      "meanConfidence": null,
      "sensitiveRate": null,
      "absoluteGap": null
    },
    {
      "lower": 0.5,
      "upper": 0.6,
      "count": 0,
      "meanConfidence": null,
      "sensitiveRate": null,
      "absoluteGap": null
    },
    {
      "lower": 0.6,
      "upper": 0.7,
      "count": 0,
      "meanConfidence": null,
      "sensitiveRate": null,
      "absoluteGap": null
    },
    {
      "lower": 0.7,
      "upper": 0.8,
      "count": 1,
      "meanConfidence": 0.726041904967,
      "sensitiveRate": 1.0,
      "absoluteGap": 0.273958095033
    },
    {
      "lower": 0.8,
      "upper": 0.9,
      "count": 3,
      "meanConfidence": 0.845810565194,
      "sensitiveRate": 1.0,
      "absoluteGap": 0.154189434806
    },
    {
      "lower": 0.9,
      "upper": 1.0,
      "count": 100,
      "meanConfidence": 0.994011985763,
      "sensitiveRate": 1.0,
      "absoluteGap": 0.005988014237
    }
  ],
  "families": [
    {
      "family": "adversarial-structural-secret",
      "label": "sensitive",
      "records": 28,
      "groups": 7,
      "truePositive": 28,
      "trueNegative": 0,
      "falsePositive": 0,
      "falseNegative": 0,
      "precision": 1.0,
      "recall": 1.0,
      "falsePositiveRate": null
    },
    {
      "family": "developer-config",
      "label": "benign",
      "records": 24,
      "groups": 6,
      "truePositive": 0,
      "trueNegative": 24,
      "falsePositive": 0,
      "falseNegative": 0,
      "precision": null,
      "recall": null,
      "falsePositiveRate": 0.0
    },
    {
      "family": "documented-public-prefix-shape",
      "label": "sensitive",
      "records": 24,
      "groups": 6,
      "truePositive": 24,
      "trueNegative": 0,
      "falsePositive": 0,
      "falseNegative": 0,
      "precision": 1.0,
      "recall": 1.0,
      "falsePositiveRate": null
    },
    {
      "family": "known-safe-shapes",
      "label": "benign",
      "records": 36,
      "groups": 9,
      "truePositive": 0,
      "trueNegative": 36,
      "falsePositive": 0,
      "falseNegative": 0,
      "precision": null,
      "recall": null,
      "falsePositiveRate": 0.0
    },
    {
      "family": "ordinary-developer-text",
      "label": "benign",
      "records": 32,
      "groups": 8,
      "truePositive": 0,
      "trueNegative": 32,
      "falsePositive": 0,
      "falseNegative": 0,
      "precision": null,
      "recall": null,
      "falsePositiveRate": 0.0
    },
    {
      "family": "secret-like-near-miss",
      "label": "benign",
      "records": 12,
      "groups": 3,
      "truePositive": 0,
      "trueNegative": 12,
      "falsePositive": 0,
      "falseNegative": 0,
      "precision": null,
      "recall": null,
      "falsePositiveRate": 0.0
    },
    {
      "family": "unknown-base64url",
      "label": "sensitive",
      "records": 20,
      "groups": 5,
      "truePositive": 20,
      "trueNegative": 0,
      "falsePositive": 0,
      "falseNegative": 0,
      "precision": 1.0,
      "recall": 1.0,
      "falsePositiveRate": null
    },
    {
      "family": "unknown-mixed-assignment",
      "label": "sensitive",
      "records": 32,
      "groups": 8,
      "truePositive": 32,
      "trueNegative": 0,
      "falsePositive": 0,
      "falseNegative": 0,
      "precision": 1.0,
      "recall": 1.0,
      "falsePositiveRate": null
    }
  ],
  "draftStateBytes": 1913,
  "latency": {
    "status": "not-measured",
    "reasonCode": "requires-extension-m4-benchmark"
  },
  "gates": {
    "heldOutGroupIsolation": true,
    "deterministicTrainingState": true,
    "rawLeakFree": true,
    "criticalKnownRecall": true,
    "balancedBenignFalsePositiveRate": true,
    "syntheticSensitiveRecall": true,
    "calibrationComputed": true,
    "draftStateSize": true,
    "catalogHumanReview": false,
    "licensedBenignCorpus": false,
    "representativeBenignSet": false,
    "applicationLayeredRecall": false,
    "extensionLatency": false,
    "extensionBundleGrowth": false,
    "calibrationApproved": false
  },
  "blockers": [
    "catalogHumanReview",
    "licensedBenignCorpus",
    "representativeBenignSet",
    "applicationLayeredRecall",
    "extensionLatency",
    "extensionBundleGrowth",
    "calibrationApproved"
  ],
  "limitations": [
    "synthetic-only-evaluation",
    "pending-generator-catalog-human-review",
    "no-representative-benign-corpus",
    "no-application-layered-baseline-comparison",
    "extension-performance-deferred-to-m4",
    "calibration-not-human-approved"
  ]
}
